country,adm1_pcode,adm1_name,adm1_overview,overview_source_url
Somalia,SO13,Togdheer,"Somaliland interior region; Burao is a major livestock trading hub. Periodic drought stress affecting pastoralists. IOM DTM displacement monitoring shows Togdheer displacement patterns are 96% intra-regional (mostly drought-driven), indicating relative stability. ",https://reliefweb.int/report/somalia/somalia-drought-displacement-monitoring-dashboard-april-2022  https://en.wikipedia.org/wiki/Burao
Somalia,SO26,Gedo,"Southwestern border region. The economy mostly depends on livestock and farming. IOM DTM Emergency Trend Tracking records Gedo as consistently among the most displacement-affected regions. Al-Shabaab maintains a significant and strategic presence across Gedo, controlling large rural swaths and several towns- including El Adde and Cows Qurun",https://reliefweb.int/report/somalia/displacement-tracking-matrix-dtm-somalia-emergency-trend-tracking-ett-gedo-bay-hiraan-middle-shabelle-and-banadir-regions-week-47-nov-19-nov-25-2023  https://www.euaa.europa.eu/coi/somalia/2025/security-situation/21-jubbaland/211-gedo
Somalia,SO23,Lower Shabelle,"Major banana and sorghum production region. Fertile agricultural zone; most conflict-affected Somali region per ACLED data (1,655 security incidents April 2023-July 2025, highest in the country). Al-Shabaab actively contests territory; military operations by Somali forces ongoing. Severe IDP displacement into Banadir. ",https://www.euaa.europa.eu/country-guidance-somalia/security-situation-somalia-recent-events
Somalia,SO22,Banadir,"Single-district region encompassing Mogadishu, Somalia's capital. Economy based largely on the export of agricultural products such as fruit, sugarcane, and corn, livestock, and animal products. ACLED records Banadir as second-most conflict-intensive region (955 security incidents April 2023-July 2025). High number of IDP receiving region.",https://www.euaa.europa.eu/country-guidance-somalia/security-situation-somalia-recent-events  https://www.ebsco.com/research-starters/geography-and-cartography/mogadishu-somalia
Somalia,SO14,Sool,Disputed region between Somaliland and Puntland. Pastoralism and cross-border trade. OCHA's 2022 drought snapshot lists Sool among most drought-affected regions with deteriorating conditions in two districts.,https://www.unocha.org/publications/report/somalia/somalia-2025-2026-drought-emergency-situation-report-no-5-6-april-2026
Somalia,SO20,Hiraan,Central Shabelle River valley. The local economy faces volatility due to climatic shocks and relies heavily on remittances and livestock exports. Al-Shabaab active in rural areas while federal forces hold key towns.,"https://en.wikipedia.org/wiki/Hiran,_Somalia"
Somalia,SO19,Galgaduud,"Central Somalia; arid pastoralism and inter-clan conflict. ACLED records Galgaduud as the region with the highest cumulative fatalities in Somalia during April 2023-July 2025, driven by inter-clan violence and Al-Shabaab activity. Escalating interclan violence in Galgaduud is the primary driver of displacement.",https://www.euaa.europa.eu/coi/somalia/2025/security-situation/25-galmudug/251-galgaduud
Somalia,SO25,Bakool,Southwestern semi-arid region; subsistence farming along agropastoral livelihoods. Livestock serve as the main economic resource. OCHA situation reports document ongoing Al-Shabaab presence and food insecurity requiring humanitarian response.,https://reliefweb.int/report/somalia/displacement-tracking-matrix-dtm-somalia-emergency-trend-tracking-ett-gedo-bay-hiraan-middle-shabelle-and-banadir-regions-week-46-nov-12-nov-18-2023 https://fsnau.org/downloads/Bakool-Agro-pastoral-Profile.pdf
Somalia,SO18,Mudug,"Central region split between Puntland and Galmudug administrations. It features a rural economy based largely on pastoralist livelihoods and limited agriculture. The security environment is volatile due to inter-clan feuds and conflicting jurisdiction. Nearly 80,000 people newly displaced within weeks in February 2026 in Mudug due to drought.",https://www.acaps.org/en/countries/somalia  https://en.wikipedia.org/wiki/Mudug
Somalia,SO27,Middle Juba,"Southern riverine region; agricultural potential along the Jubba River. The only region in Somalia fully controlled by Al-Shabaab. Al-Shabaab control of rural access routes; humanitarian access severely restricted. As of 2022, Middle Juba has the lowest Human Development Index score in the world out of 1,790 subnational regions.",https://en.wikipedia.org/wiki/Middle_Juba
Somalia,SO28,Lower Juba,Southernmost coastal region; port city of Kismayo serves as Jubaland's capital. Pastoralism. Key strategic importance to Al-Shabaab’s operations. The group conducted a number of attacks on military bases.,https://www.euaa.europa.eu/country-guidance-somalia/security-situation-somalia-recent-events
Somalia,SO24,Bay,Southwestern agricultural heartland. Agro-pastoral economy. Bay was the third-most conflict-intensive Somali region between April 2023-July 2025 (756 security incidents). IOM DTM records Bay as major conflict and drought displacement source. Al-Shabaab active in rural areas.,https://www.euaa.europa.eu/print/pdf/node/27391
Somalia,SO21,Middle Shabelle,"Agricultural region; rice and sesame farming. Middle Shabelle was the second-highest in fatalities (2,480) in Somalia during April 2023-July 2025 period. Al-Shabaab has retaken towns previously cleared by Somali government forces. Military operations and inter-clan clashes drive ongoing displacement into Banadir.",https://www.euaa.europa.eu/country-guidance-somalia/b-assessment-indiscriminate-violence-region
South Sudan,SS10,Western Equatoria,"Forested southwestern state; teak logging and subsistence farming. Over 165,000 people displaced since June 2025 due to conflict and airstrikes in Nagero, Tambura, Ezo, Mundri East, and Ibba counties. Lord's Resistance Army (LRA) incursions (2008-2017)  caused mass displacement; current government-community conflict ongoing.",https://www.unocha.org/publications/report/south-sudan/south-sudan-humanitarian-snapshot-october-2025 https://www.unhcr.org/news/briefing-notes/new-lra-attacks-trigger-more-displacement-southern-sudan
South Sudan,SS02,Eastern Equatoria,Southeastern state; mixed farming and cattle herding. Intercommunal violence and  chronic insecurity are documented.,https://www.unocha.org/publications/report/south-sudan/south-sudan-humanitarian-response-situation-report-no-1-16-april-2026
South Sudan,SS09,Western Bahr el Ghazal,"Northwestern state; cattle herding and subsistence farming. One of the most secured and politically stable states in South Sudan. High poverty rate with chronic food insecurity. Food security is heavily compromised by poor harvests due to irregular rainfall and flooding, high market prices, influx of returnees and new IDPs, as well as limited access to land in peri-urban IDP sites and relocation areas.
",https://southsudan.un.org/en/305164-western-bahr-el-ghazal
South Sudan,SS01,Central Equatoria,"Contains Juba, the national capital. Subsistence farming and livestock production. In Central
Equatoria, some areas remain inaccessible due to insecurity caused by hold-out groups like the National Salvation Front (NAS). Cattle migration and land grabbing are major sources of conflict in Central Equatoria. ",https://reliefweb.int/report/south-sudan/conflict-drivers-and-priorities-peace-among-communities-central-equatoria-state-south-sudan-november-2024
South Sudan,SS08,Warrap,"North-central state; cattle herding and subsistence farming. Wetland disputes, small arms proliferation, and poverty-driven cattle raiding have intensified violent conflict between Warrap and neighboring Unity and Lakes states.",https://www.saferworld-global.org/resources/publications/1429-tackling-conflict-drivers-for-peace-and-security-in-warrap-state-south-sudan
South Sudan,SS05,Northern Bahr el Ghazal,Northwestern state; subsistence farming and cattle herding. High food insecurity and one of South Sudan's poorest states. The urgent restoration and scale?up of health services remains critical.,https://www.unocha.org/publications/report/south-sudan/south-sudan-humanitarian-response-situation-report-no-1-16-april-2026
South Sudan,SS07,Upper Nile,"Oil-producing northeastern state; Paloch oilfields are critical to national revenue. High IDP rate. As of October 2025, the state accommodates over 225,000 IDPs. 73,000 people are facing starvation and death in Upper Nile and Jonglei states, where fighting between government forces and the Sudan People’s Liberation Army in Opposition has escalated since 2025. Risk of famine.  ",https://www.unocha.org/publications/report/south-sudan/south-sudan-conflict-jonglei-state-flash-update-no14-26-march-2026 https://southsudan.un.org/en/304299-upper-nile https://www.hrw.org/news/2026/05/06/civilians-starving-in-south-sudans-conflict-areas
South Sudan,SS04,Lakes,South-central state; pastoralism. High IDP rate. Lakes State classified as IPC Phase 4 (Emergency) in 2025 food security analysis. Chronic inter-clan violence documented since 2013.,https://www.unocha.org/publications/report/south-sudan/south-sudan-conflict-jonglei-state-flash-update-no-4-3-february-2026
South Sudan,SS03,Jonglei,"Largest state by area: livestock, agriculture and fishing. Since the conflict began in late December 2025, approximately 1.35 million people in Jonglei State have lost access to essential health services due to damage, looting, and service disruptions. Cholera outbreak since September 2024. 73,000 people are facing starvation and death in Upper Nile and Jonglei states, where fighting between government forces and the Sudan People’s Liberation Army in Opposition has escalated since 2025. ",https://www.unocha.org/publications/report/south-sudan/south-sudan-conflict-jonglei-state-flash-update-no14-26-march-2026
South Sudan,SS06,Unity,Oil-rich northwestern state; agro-pastoralism. Epicenter of extreme atrocities during 2013-2018 civil war. The humanitarian and security situation in Unity State significantly deteriorated between January and February 2026. This period was marked by intense military confrontations between the South Sudan People’s Defence Forces (SSPDF) and the Sudan People’s Liberation Army-In Opposition (SPLA-IO).,https://www.unocha.org/publications/report/south-sudan/south-sudan-humanitarian-snapshot-october-2025 https://reliefweb.int/report/south-sudan/south-sudan-event-tracking-report-97-unity-state-01-january-16-february-2026
